ID_PLAN,DS_PLAN,DS_CITY,TAXONOMIES
62567,Circuito de spa en Tyris Spa,Valencia,"Wellness Center, Low Intensity, Regular, Couple, Adults (25-35), Any Moment, Session Based, Spa, Body Treatment"
77573,Aloha Poké: transpórtate a Hawaii,Valencia,"Restaurant, Low Intensity, Regular, Any Profile, Any Age, Lunch, Dinner, Session Based, Healthy Food"
77906,Poké Shop: los healthy bowls de moda,Valencia,"Restaurant, Low Intensity, Regular, Foodie, Any Age, Lunch, Dinner, Session Based, Other Asian Food, Raw Food"
78729,Alenar Bodega mediterránea: menú de lujo,Valencia,"Restaurant, Low Intensity, Special Offer, Foodie, Adults (25-35), Middle-youth (34-45), Dinner, Session Based, Other Mediterranean Food, Valentines Day"
81003,Zalamero Ruzafa Bar: menú para 2 personas en su local,Valencia,"Restaurant, Low Intensity, Special Offer, Couple, Foodie, Any Age, Lunch, Dinner, Session Based, Spanish Food"
84342,Almalibre Açaí House: el mejor açaí de Valencia,Valencia,"Juice, Session Based, Evening, Afternoon, Any Age, Foodie, Regular, Low Intensity, Bar"
88622,Alenar: un esmorzaret gourmet,Valencia,"Restaurant, Low Intensity, Special Offer, Any Profile, Any Age, Morning, Session Based, Sandwich"
92810,La Pappardella: menú degustación a la italiana,Valencia,"Restaurant, Low Intensity, Special Offer, Any Profile, Any Age, Lunch, Dinner, Session Based, Italian Food"
92867,Entrada a la Parroquia de San Nicolás de Bari,Valencia,"Museum, Low Intensity, Special Offer, Tourist, Cultured, Any Age, Morning, Afternoon, Session Based, Museum Visit"
92868,"Recorrido turístico, visita a L'Oceanogràfic y cena",Valencia,"Street, High Intensity, Special Offer, Tourist, Any Age, Dinner, Afternoon, Evening, Session Based, Indian Food, Guided Visit"
93492,Menú degustación 10 en Portolito Centro,Valencia,"Restaurant, Low Intensity, Special Offer, Any Profile, Any Age, Lunch, Dinner, Session Based, Other Mediterranean Food"
94365,Al Pomodoro: menú degustación a la italiana,Valencia,"Restaurant, Low Intensity, Special Offer, Foodie, Any Age, Lunch, Dinner, Session Based, Pizza, Pasta, Italian Food"
94708,Tarjeta Regalo Fever - Valencia,Valencia,"Other Mixed, Low Intensity, Special Offer, Any Profile, Any Age, Any Moment, Timeless, Terror Tour, Valentines Day, Christmas, Mothers Day, Fathers Day"
94714,Tarjeta regalo Candlelight - Valencia,Valencia,"Other Indoors, Low Intensity, Exclusive, Cultured, Middle-youth (34-45), More Adults (45+), Any Moment, Timeless, Classical Solo & Ensembles, Candlelight concert, Candlelight Summer, Small Gig, Valentines Day, Christmas, Mothers Day, Fathers Day, Bono Cultural Joven"
95094,Menú tapeo degustación de cocina fusión en Portolito Carmen,Valencia,"Restaurant, Low Intensity, Regular, Any Profile, Any Age, Lunch, Session Based, Spanish Food"
96624,Terraceo con cerveza o sangría y picoteo en Saint Martin's,Valencia,"Pub, Low Intensity, Exclusive, Any Profile, Young Adults (18-24), Adults (25-35), Middle-youth (34-45), Lunch, Afternoon, Session Based, Chicken, Beer"
97676,Menú degustación 10 vegetariano en Portolito Centro,Valencia,"Restaurant, Low Intensity, Regular, Any Profile, Young Adults (18-24), Adults (25-35), Middle-youth (34-45), More Adults (45+), Lunch, Session Based, Vegetarian, Other Mediterranean Food"
105414,Visita el apasionante Museo de la Seda de Valencia,Valencia,"Museum, Low Intensity, Regular, Cultured, Any Profile, Any Age, Any Moment, Session Based, Museum Visit"
108546,Menú degustación en Portolito Playa,Valencia,"Restaurant, Low Intensity, Regular, Any Profile, Any Age, Evening, Limited Series, Fusion Food"
109767,Hemisfèric: un hipnotizante espectáculo de luz y cine sin colas,Valencia,"Other Indoors, Low Intensity, Exclusive, Any Profile, Any Age, Morning, Afternoon, Evening, Session Based, Mainstream Cinema"
109769,Oceanogràfic de Valencia: Entrada sin colas,Valencia,"Amusement Park, Low Intensity, Regular, Any Profile, Any Age, Morning, Afternoon, Evening, Session Based, Exhibition, Nature Tour"
110471,Candlelight: Tributo a Ludovico en el Hotel Westin,Valencia,"Other Indoors, Low Intensity, Exclusive, Any Profile, Any Age, Evening, One Time Event, Candlelight concert, Small Gig, Bono Cultural Joven"
110473,Candlelight: Tributo a Queen en Hotel Westin,Valencia,"Other Indoors, Low Intensity, Exclusive, Any Profile, Any Age, Evening, One Time Event, Candlelight concert, Small Gig, Bono Cultural Joven"
110638,La Capilla Sixtina de Miguel Ángel: La Exhibición - Lista de espera,Valencia,"Other Indoors, Low Intensity, Exclusive, Any Profile, Any Age, Morning, Afternoon, Evening, Limited Series, Art Gallery, Exhibition"
110918,The Chocolate Factory: adéntrate en el mundo más dulce - Lista de Espera,Valencia,"Other Indoors, Low Intensity, Exclusive, Any Profile, Any Age, Morning, Afternoon, Limited Series, Chocolate, Exhibition"
111695,Entrada sin colas al Oceanogràfic y al Hemisfèric,Valencia,"Museum, Medium Intensity, Regular, Any Profile, Any Age, Morning, Afternoon, Limited Series, Museum Visit"
111696,Oceanogràfic y Museo de las Ciencias: entrada sin colas,Valencia,"Museum, Medium Intensity, Regular, Cultured, Any Profile, Any Age, Morning, Afternoon, Limited Series, Museum Visit"
111719,Bioparc Valencia: entrada con acceso rápido,Valencia,"Nature, Low Intensity, Regular, Parents With Kids, Any Profile, Any Age, Morning, Afternoon, Limited Series, Animals/Zoo"
112946,Candlelight: Tributo a Hans Zimmer en Hotel Westin,Valencia,"Other Indoors, Low Intensity, Exclusive, Any Profile, Any Age, Evening, One Time Event, Classical Solo & Ensembles, Candlelight concert, Small Gig, Bono Cultural Joven"
114508,Concierto Secreto: una experiencia musical secreta en Valencia,Valencia,"Other Mixed, Low Intensity, Regular, Parents With Kids, Any Age, Evening, Session Based, Concert"
115102,Mediterráneo Sound Segunda Edición - Lista de espera,Valencia,"Other Outdoors, Medium Intensity, Exclusive, Any Profile, Any Age, Morning, Afternoon, Evening, One Time Event, Pop, Rock, Concert"
118422,Visita guiada por el Estadio de Mestalla,Valencia,"Stadium, Medium Intensity, Regular, Any Profile, Any Age, Afternoon, Session Based, Football(Soccer), Guided Visit"
121797,"Escape Room: Olivanders, la tienda mágica",Valencia,"Other Indoors, Low Intensity, Regular, Any Profile, Any Age, Morning, Afternoon, Evening, Session Based, Escape Room, Magic"
121798,"Escape Room: Elisabeth, el orfanato",Valencia,"Other Indoors, High Intensity, Regular, Any Profile, Any Age, Any Moment, Timeless, Escape Room"
121799,"Escape Room: SAW, la fábrica abandonada",Valencia,"Other Indoors, High Intensity, Regular, Any Profile, Any Age, Any Moment, Timeless, Escape Room"
121803,Escape Room: El templo mágico de Angora,Valencia,"Other Indoors, High Intensity, Regular, Any Profile, Any Age, Any Moment, Timeless, Escape Room"
121813,Escape Room: La herencia del Panteón,Valencia,"Other Indoors, High Intensity, Regular, Any Profile, Any Age, Any Moment, Timeless, Escape Room"
123621,Candlelight: Homenaje a Ennio Morricone en Ateneo Mercantil,Valencia,"Other Indoors, Low Intensity, Exclusive, Any Profile, Any Age, Evening, One Time Event, Candlelight concert, Small Gig, Bono Cultural Joven"
128987,Candlelight: 100 Años de Warner Bros.,Valencia,"Church/Cathedral, Low Intensity, Exclusive, Any Profile, Any Age, Evening, One Time Event, Candlelight concert, Small Gig, Bono Cultural Joven"
129402,Candlelight: Tributo a Coldplay en Hotel Westin Valencia,Valencia,"Other Indoors, Low Intensity, Exclusive, Any Profile, Any Age, Evening, One Time Event, Pop, Candlelight concert, Small Gig, Bono Cultural Joven"
136940,Una tapa + una bebida en Portolito Carmen,Valencia,"Restaurant, Low Intensity, Regular, Any Profile, Any Age, Lunch, Session Based, Tapas"
137210,Murder Mystery: Asesinato en el Ateneo Mercantil,Valencia,"Other Indoors, Low Intensity, Exclusive, Any Profile, Any Age, Evening, Session Based, Escape Room, Survival Game, Halloween"
137304,Tarjeta Regalo Cine,Valencia,"Cinema, Low Intensity, Exclusive, Cultured, Middle-youth (34-45), More Adults (45+), Any Moment, Timeless, Mainstream Cinema, Valentines Day, Christmas, Mothers Day, Fathers Day, Bono Cultural Joven"
137577,Pinta un cuadro neón mientras bebes unos vinos,Valencia,"Other Indoors, High Intensity, Regular, Any Profile, Young Adults (18-24), Adults (25-35), Middle-youth (34-45), More Adults (45+), Afternoon, Session Based, Wine, Painting/Drawing Course"
139026,Candlelight: Las Cuatro Estaciones de Vivaldi en The Westin Valencia,Valencia,"Other Indoors, Low Intensity, Exclusive, Any Profile, Any Age, Evening, Limited Series, Classical Solo & Ensembles, Candlelight concert, Bono Cultural Joven"
139382,Candlelight: Tributo a ABBA,Valencia,"Other Indoors, Low Intensity, Exclusive, Any Profile, Any Age, Evening, One Time Event, Pop, Candlelight concert, Small Gig, Bono Cultural Joven"
139602,Ruta de la Seda en Valencia: Tour guiado,Valencia,"Street, Low Intensity, Regular, Tourist, Any Age, Morning, Session Based, Sightseeing Tour"
139620,Tour del casco antiguo de Valencia con vino y tapas en un monumento del siglo XI,Valencia,"Street, Low Intensity, Regular, Tourist, Any Age, Morning, Session Based, Sightseeing Tour"
139621,Iglesia de San Nicolás + Audioguía,Valencia,"Church/Cathedral, Low Intensity, Regular, Tourist, Any Age, Morning, Afternoon, Limited Series, Guided Visit"
139623,Tablao Flamenco El Toro y la Luna Espectáculo & Cena & Bebida,Valencia,"Other Indoors, Low Intensity, Regular, Any Profile, Any Age, Dinner, Limited Series, Spanish Food, Flamenco"
139624,Ciudad de las Artes y las Ciencias de Valencia: Tour + Cata de vinos y tapas,Valencia,"Street, Low Intensity, Regular, Tourist, Any Age, Morning, Session Based, Wine Tasting, Museum Visit, Sightseeing Tour"
139636,Farga en concierto en Mestalla,Valencia,"Stadium, Low Intensity, Regular, Any Profile, Any Age, Evening, One Time Event, Pop, Concert"